[
  {
    "id": "2a383402-50c3-40c9-9279-cd1f324c77cc",
    "game": "STARRAIL",
    "name": "4.5下半",
    "type": "下半卡池",
    "startAt": "2026-09-12T12:00:00+08:00",
    "endAt": "2026-09-28T04:00:00+08:00",
    "characters": [
      "砂金·戏浪",
      "不死途"
    ],
    "notes": "",
    "enabled": true
  },
  {
    "id": "69eec77d-2226-49ef-afa2-541d2904c8fe",
    "game": "GENSHIN",
    "name": "7.0上半",
    "type": "上半卡池",
    "startAt": "2026-08-12T00:00:00+08:00",
    "endAt": "2026-09-01T18:00:00+08:00",
    "characters": [
      "奥黛塔",
      "阿蕾奇诺"
    ],
    "notes": "Migrated from calendar event 528b0f8f41a44c05998174bf2dc9e28d；原神 | 2026-08-12 - 2026-09-01 | User-provided calendar screenshot; phase 1 wish",
    "enabled": true
  },
  {
    "id": "787d7895-fb78-4c03-9b67-4958f1e8e771",
    "game": "GENSHIN",
    "name": "7.0下半",
    "type": "下半卡池",
    "startAt": "2026-09-01T18:00:00+08:00",
    "endAt": "2026-09-22T04:00:00+08:00",
    "characters": [
      "菲林斯",
      "伊涅芙"
    ],
    "notes": "",
    "enabled": true
  },
  {
    "id": "a9f8bc42-71c1-426f-86aa-d9c6da222f52",
    "game": "NTE",
    "name": "1.3下半",
    "type": "下半卡池",
    "startAt": "2026-09-03T06:00:00+08:00",
    "endAt": "2026-09-25T05:00:00+08:00",
    "characters": [
      "灵可",
      "浔"
    ],
    "notes": "Migrated from calendar event 4daf492c010f44f39563899e62d0d7e8；异环 | 2026-09-03 - 2026-09-24 | User-provided calendar screenshot",
    "enabled": true
  },
  {
    "id": "d351ed1c-228f-4038-b186-131c7f64ab19",
    "game": "NTE",
    "name": "1.3上半",
    "type": "上半卡池",
    "startAt": "2026-08-13T00:00:00+08:00",
    "endAt": "2026-09-03T00:00:00+08:00",
    "characters": [
      "残虹",
      "娜娜莉"
    ],
    "notes": "Migrated from calendar event 39f3b9d5c3bd498c89c984c0a683f0d7；异环 | 2026-08-13 - 2026-09-03 | User-provided calendar screenshot",
    "enabled": true
  },
  {
    "id": "e46fd0bf-2f46-4aa5-b0b0-6dd5f29d84ee",
    "game": "STARRAIL",
    "name": "4.5上半",
    "type": "上半卡池",
    "startAt": "2026-08-26T11:00:00+08:00",
    "endAt": "2026-09-12T12:00:00+08:00",
    "characters": [
      "知更鸟·晴歌",
      "风堇"
    ],
    "notes": "",
    "enabled": true
  },
  {
    "id": "76967abf-f471-4bea-89e4-13b54fb58620",
    "game": "GENSHIN",
    "name": "自选邀请·限定5星角色",
    "type": "自选邀请",
    "startAt": "2026-09-23T04:00:00+08:00",
    "endAt": "2026-11-03T03:59:00+08:00",
    "characters": [
      "待确认"
    ],
    "notes": "User-provided 7.1/1.4 activity calendar image",
    "enabled": true
  },
  {
    "id": "3f42f793-964a-4798-ac4a-ccbe090e6a52",
    "game": "GENSHIN",
    "name": "自选邀请·常驻祈愿5星角色",
    "type": "自选邀请",
    "startAt": "2026-09-23T04:00:00+08:00",
    "endAt": "2026-11-03T03:59:00+08:00",
    "characters": [
      "待确认"
    ],
    "notes": "User-provided 7.1/1.4 activity calendar image",
    "enabled": true
  },
  {
    "id": "46b8c8b9-f217-4211-ace5-6f87d81a12c5",
    "game": "GENSHIN",
    "name": "7.1祈愿（第一期）",
    "type": "祈愿",
    "startAt": "2026-09-23T04:00:00+08:00",
    "endAt": "2026-10-13T04:00:00+08:00",
    "characters": [
      "待确认"
    ],
    "notes": "User-provided 7.1/1.4 activity calendar image",
    "enabled": true
  },
  {
    "id": "10819314-cc41-412f-a344-9882ae16fa38",
    "game": "GENSHIN",
    "name": "7.1祈愿（第二期）",
    "type": "祈愿",
    "startAt": "2026-09-23T04:00:00+08:00",
    "endAt": "2026-10-13T04:00:00+08:00",
    "characters": [
      "丝柯克 爱可菲"
    ],
    "notes": "User-provided 7.1/1.4 activity calendar image",
    "enabled": true
  },
  {
    "id": "ad32890f-9193-4414-b54b-66570d6b3695",
    "game": "NTE",
    "name": "预言终幕时",
    "type": "限定招募",
    "startAt": "2026-09-24T04:00:00+08:00",
    "endAt": "2026-10-15T04:00:00+08:00",
    "characters": [
      "待确认"
    ],
    "notes": "User-provided 7.1/1.4 activity calendar image",
    "enabled": true
  },
  {
    "id": "e5de9cbb-1e07-46c2-8302-e1f7f54ee6d5",
    "game": "NTE",
    "name": "灿烂的星",
    "type": "限定招募",
    "startAt": "2026-10-15T04:00:00+08:00",
    "endAt": "2026-11-05T04:00:00+08:00",
    "characters": [
      "待确认"
    ],
    "notes": "User-provided 7.1/1.4 activity calendar image",
    "enabled": true
  },
  {
    "id": "00314068-015c-45f5-bc97-9fb60f83b926",
    "game": "NTE",
    "name": "久梦初醒时",
    "type": "限定招募",
    "startAt": "2026-09-24T04:00:00+08:00",
    "endAt": "2026-10-15T04:00:00+08:00",
    "characters": [
      "待确认"
    ],
    "notes": "User-provided 7.1/1.4 activity calendar image",
    "enabled": true
  },
  {
    "id": "2e295301-724c-4e20-9a5d-a3a372a8b8e0",
    "game": "NTE",
    "name": "栖羽特刊",
    "type": "弧盒研募",
    "startAt": "2026-09-24T04:00:00+08:00",
    "endAt": "2026-10-15T04:00:00+08:00",
    "characters": [
      "待确认"
    ],
    "notes": "User-provided 7.1/1.4 activity calendar image",
    "enabled": true
  },
  {
    "id": "7bea6a06-4c18-4f14-843f-64560425c699",
    "game": "NTE",
    "name": "夜曲特刊",
    "type": "弧盒研募",
    "startAt": "2026-09-24T04:00:00+08:00",
    "endAt": "2026-10-15T04:00:00+08:00",
    "characters": [
      "待确认"
    ],
    "notes": "User-provided 7.1/1.4 activity calendar image",
    "enabled": true
  },
  {
    "id": "5eb81306-2d17-42ca-924f-c1338d592168",
    "game": "NTE",
    "name": "日月星特刊",
    "type": "弧盒研募",
    "startAt": "2026-10-15T04:00:00+08:00",
    "endAt": "2026-11-05T04:00:00+08:00",
    "characters": [
      "待确认"
    ],
    "notes": "User-provided 7.1/1.4 activity calendar image",
    "enabled": true
  }
]
